{
  "$schema": "http://json-schema.org/draft-07/schema#",
  "title": "Artifact",
  "description": "Metadata schema for a single media artifact within a Dynamic Documentary Engine collection",
  "type": "object",
  "required": [
    "artifact_id",
    "collection_id",
    "artifact_type",
    "role",
    "file",
    "content",
    "sequencing"
  ],
  "properties": {

    "artifact_id": {
      "type": "string",
      "description": "Unique identifier for this artifact",
      "example": "ww2_av_003"
    },

    "collection_id": {
      "type": "string",
      "description": "The collection this artifact belongs to",
      "example": "ww2"
    },

    "artifact_type": {
      "type": "string",
      "description": "The media class of this artifact",
      "enum": ["A-roll", "B-roll", "X-roll"],
      "enumDescriptions": {
        "A-roll": "Synchronized audio and video â€” stands alone in the sequence",
        "B-roll": "Video only â€” must always be paired with an X-roll for audio",
        "X-roll": "Audio only â€” always layered over a B-roll clip, never placed alone"
      }
    },

    "role": {
      "type": "string",
      "description": "The functional role of this artifact in a generated film",
      "enum": ["opening", "closing", "body"],
      "enumDescriptions": {
        "opening": "Always appears at the start of every generated film in this collection",
        "closing": "Always appears at the end of every generated film in this collection",
        "body": "Available for selection by the sequencing engine"
      }
    },

    "file": {
      "type": "object",
      "description": "File-level information for this artifact, including its source type and location",
      "required": ["source_type", "format", "duration_seconds", "has_video", "has_audio"],
      "properties": {

        "source_type": {
          "type": "string",
          "description": "Where the media comes from. 'local' means a stored file on disk or an external drive. 'stream' means a live source such as a webcam RTSP or HLS feed. The assembler uses this field to determine how to pass the source to FFmpeg.",
          "enum": ["local", "stream"],
          "default": "local"
        },

        "filename": {
          "type": "string",
          "description": "The filename including extension. Required when source_type is 'local'. Omit when source_type is 'stream'.",
          "example": "ww2_av_003.mp4"
        },

        "stream_url": {
          "type": "string",
          "description": "Full URL of the live stream. Required when source_type is 'stream'. Omit when source_type is 'local'. Supports RTSP, HLS (.m3u8), and HTTP direct streams.",
          "example": "rtsp://camera.example.com/normandy_beach_live"
        },

        "format": {
          "type": "string",
          "description": "File format or stream container",
          "enum": ["mp4", "mov", "wav", "mp3", "webm", "m3u8", "rtsp"]
        },

        "duration_seconds": {
          "type": "number",
          "description": "Duration of the artifact in seconds. For live stream artifacts, this is the number of seconds the assembler will capture from the stream for this slot.",
          "minimum": 0,
          "example": 24.5
        },

        "has_video": {
          "type": "boolean",
          "description": "Whether this artifact contains a video track. Always true for A-roll and B-roll. Always false for X-roll."
        },

        "has_audio": {
          "type": "boolean",
          "description": "Whether this artifact contains an audio track. Always true for A-roll and X-roll. Always false for B-roll."
        },

        "resolution": {
          "type": "string",
          "description": "Video resolution if applicable. Omit for audio-only X-roll artifacts.",
          "example": "1920x1080"
        },

        "source": {
          "type": "string",
          "description": "Origin of the artifact",
          "enum": ["self-recorded", "public-domain", "live-webcam"],
          "example": "public-domain"
        },

        "copyright_cleared": {
          "type": "boolean",
          "description": "Whether this artifact is cleared for use in the project"
        }

      },

      "allOf": [
        {
          "if": {
            "properties": { "source_type": { "const": "local" } },
            "required": ["source_type"]
          },
          "then": {
            "required": ["filename"]
          }
        },
        {
          "if": {
            "properties": { "source_type": { "const": "stream" } },
            "required": ["source_type"]
          },
          "then": {
            "required": ["stream_url"]
          }
        }
      ]

    },

    "content": {
      "type": "object",
      "description": "Descriptive metadata about the content of this artifact. These fields are for human reference and collection-design purposes. The sequencing engine uses them only for dissimilarity scoring â€” to maximise contrast between consecutive clips â€” never to enforce tonal matching, mood continuity, or emotional arcs.",
      "required": ["title", "description", "theme", "mood", "pacing", "tags"],
      "properties": {
        "title": {
          "type": "string",
          "description": "Short human-readable title for this artifact",
          "example": "Soldiers marching through village"
        },
        "description": {
          "type": "string",
          "description": "Longer description of what this artifact contains",
          "example": "Black and white footage of soldiers moving through a destroyed village, ambient sounds of distant artillery"
        },
        "theme": {
          "type": "array",
          "description": "Thematic tags describing the subject matter. Used by the selector for dissimilarity scoring only â€” not for thematic matching.",
          "items": { "type": "string" },
          "example": ["war", "movement", "destruction", "soldiers"]
        },
        "mood": {
          "type": "string",
          "description": "The dominant emotional tone of this artifact. Present for human reference and used by the selector as one dissimilarity dimension â€” the engine actively seeks mood contrast, not mood continuity.",
          "enum": ["somber", "tense", "hopeful", "neutral", "triumphant", "melancholic", "urgent", "reflective"],
          "example": "somber"
        },
        "pacing": {
          "type": "string",
          "description": "The visual and editorial pacing of this artifact. Used by the selector as one dissimilarity dimension â€” the engine prefers pacing contrast between consecutive clips.",
          "enum": ["slow", "medium", "fast"],
          "example": "slow"
        },
        "tags": {
          "type": "array",
          "description": "Free-form keyword tags. Used by the selector for dissimilarity scoring â€” the engine prefers candidates with fewer overlapping tags with the previous clip.",
          "items": { "type": "string" },
          "example": ["black-and-white", "exterior", "ambient-audio", "movement"]
        },
        "dominant_colors": {
          "type": "array",
          "description": "Dominant color palette â€” used by the Dyn UIS Engine for visual continuity",
          "items": { "type": "string" },
          "example": ["gray", "brown", "black"]
        },
        "dominant_lines": {
          "type": "string",
          "description": "Dominant compositional line direction â€” used by the Dyn UIS Engine and by the selector as a dissimilarity dimension.",
          "enum": ["horizontal", "vertical", "diagonal", "curved", "mixed"],
          "example": "horizontal"
        },
        "context": {
          "type": "object",
          "description": "Optional memory-trigger context: when this clip happened and in what conditions. Matched against the screening's date, season and weather (engine/context.py).",
          "properties": {
            "date": {
              "type": "string",
              "description": "YYYY-MM-DD, YYYY-MM or YYYY. Matched on month and day (an anniversary), whatever the year.",
              "pattern": "^\\d{4}(-\\d{2}(-\\d{2})?)?$",
              "example": "1944-12-18"
            },
            "season": {
              "type": "string",
              "description": "Inferred from the date's month when omitted.",
              "enum": ["winter", "spring", "summer", "autumn"]
            },
            "weather": {
              "type": "array",
              "items": { "type": "string" },
              "example": ["snow", "cold"]
            }
          }
        }
      }
    },

    "sequencing": {
      "type": "object",
      "description": "Rules and hints that guide the sequencing engine when selecting this artifact",
      "required": ["can_repeat", "min_gap_seconds"],
      "properties": {
        "can_repeat": {
          "type": "boolean",
          "description": "Whether this artifact can appear more than once in a single generated film",
          "default": false
        },
        "min_gap_seconds": {
          "type": "number",
          "description": "Minimum seconds that must pass before this artifact can be used again",
          "default": 0,
          "example": 120
        },
        "must_follow": {
          "type": "array",
          "description": "Artifact IDs that should precede this artifact when possible. For editorial/technical reasons specific to this collection â€” not for mood or tonal shaping.",
          "items": { "type": "string" },
          "example": ["ww2_av_001"]
        },
        "must_not_follow": {
          "type": "array",
          "description": "Artifact IDs that must never directly precede this artifact. A hard structural constraint â€” use only for genuine editorial or technical incompatibilities.",
          "items": { "type": "string" },
          "example": ["ww2_av_007"]
        },
        "weight": {
          "type": "number",
          "description": "Selection weight â€” higher values make this artifact more likely to be selected during weighted random selection. A frequency control tool only, with no emotional significance.",
          "minimum": 0,
          "maximum": 1,
          "default": 0.5,
          "example": 0.8
        }
      }
    },

    "ai_enrichment": {
      "type": "object",
      "description": "Metadata generated or validated by an automated enrichment process",
      "properties": {
        "auto_tagged": {
          "type": "boolean",
          "description": "Whether this artifact was auto-tagged by an automated enrichment process"
        },
        "enrichment_date": {
          "type": "string",
          "format": "date",
          "description": "Date the AI enrichment was last run",
          "example": "2025-06-04"
        },
        "suggested_tags": {
          "type": "array",
          "description": "Additional tags suggested by an automated enrichment process",
          "items": { "type": "string" }
        },
        "confidence_score": {
          "type": "number",
          "description": "AI confidence in the metadata accuracy (0-1)",
          "minimum": 0,
          "maximum": 1,
          "example": 0.91
        }
      }
    },

    "created_at": {
      "type": "string",
      "format": "date-time",
      "description": "ISO 8601 timestamp of when this artifact was added to the collection"
    },

    "updated_at": {
      "type": "string",
      "format": "date-time",
      "description": "ISO 8601 timestamp of the last metadata update"
    }

  }
}
