{
  "artifact_id": "val_xa_003",
  "collection_id": "validation",
  "artifact_type": "X-roll",
  "role": "body",
  "file": {
    "source_type": "local",
    "filename": "x-roll/war_bong.wav",
    "format": "wav",
    "duration_seconds": 6.615979,
    "has_video": false,
    "has_audio": true,
    "source": "self-recorded",
    "copyright_cleared": true
  },
  "content": {
    "title": "War bong",
    "description": "A sharp percussive audio element for abrupt X-roll contrast.",
    "theme": [
      "percussion",
      "alarm",
      "impact"
    ],
    "mood": "tense",
    "pacing": "fast",
    "tags": [
      "percussion",
      "impact",
      "warning",
      "audio"
    ]
  },
  "sequencing": {
    "can_repeat": false,
    "min_gap_seconds": 0,
    "must_follow": [],
    "must_not_follow": [],
    "weight": 0.7
  },
  "created_at": "2026-07-02T00:00:00Z",
  "updated_at": "2026-07-03T00:00:00Z"
}
