{
  "artifact_id": "val_av_002",
  "collection_id": "validation",
  "artifact_type": "A-roll",
  "role": "body",
  "file": {
    "source_type": "local",
    "filename": "a-roll/SF_Zoo.MOV",
    "format": "mov",
    "duration_seconds": 12.348333,
    "has_video": true,
    "has_audio": true,
    "source": "self-recorded",
    "copyright_cleared": true,
    "resolution": "3840x2160"
  },
  "content": {
    "title": "San Francisco zoo",
    "description": "A zoo visit captured as observational A-roll with the location sound intact.",
    "theme": [
      "animals",
      "public-space",
      "observation"
    ],
    "mood": "reflective",
    "pacing": "slow",
    "tags": [
      "zoo",
      "san-francisco",
      "outdoor",
      "visit"
    ],
    "dominant_colors": [
      "green",
      "gray"
    ],
    "dominant_lines": "mixed"
  },
  "sequencing": {
    "can_repeat": false,
    "min_gap_seconds": 0,
    "must_follow": [],
    "must_not_follow": [],
    "weight": 0.6
  },
  "created_at": "2026-07-02T00:00:00Z",
  "updated_at": "2026-07-03T00:00:00Z"
}
