{
  "artifact_id": "val_bv_003",
  "collection_id": "validation",
  "artifact_type": "B-roll",
  "role": "body",
  "file": {
    "source_type": "local",
    "filename": "b-roll/plane_drop.mp4",
    "format": "mp4",
    "duration_seconds": 8.133333,
    "has_video": true,
    "has_audio": false,
    "source": "self-recorded",
    "copyright_cleared": true,
    "resolution": "1920x1080"
  },
  "content": {
    "title": "Plane drop",
    "description": "Aircraft footage with a dramatic drop or descent, used as silent visual counterpoint.",
    "theme": [
      "flight",
      "risk",
      "sky"
    ],
    "mood": "urgent",
    "pacing": "fast",
    "tags": [
      "plane",
      "drop",
      "sky",
      "motion"
    ],
    "dominant_colors": [
      "blue",
      "white"
    ],
    "dominant_lines": "diagonal"
  },
  "sequencing": {
    "can_repeat": false,
    "min_gap_seconds": 0,
    "must_follow": [],
    "must_not_follow": [],
    "weight": 0.7
  },
  "created_at": "2026-07-02T00:00:00Z",
  "updated_at": "2026-07-03T00:00:00Z"
}
