{
  "artifact_id": "val_av_003",
  "collection_id": "validation",
  "artifact_type": "A-roll",
  "role": "body",
  "file": {
    "source_type": "local",
    "filename": "val_av_003.mp4",
    "format": "mp4",
    "duration_seconds": 14,
    "has_video": true,
    "has_audio": true,
    "source": "self-recorded",
    "copyright_cleared": true,
    "resolution": "640x360"
  },
  "content": {
    "title": "Soldiers marching through ruins",
    "description": "Black-and-white archival footage of infantry moving through a bombed-out town, distant artillery.",
    "theme": [
      "war",
      "soldiers",
      "destruction"
    ],
    "mood": "somber",
    "pacing": "slow",
    "tags": [
      "archival",
      "black-and-white",
      "infantry",
      "war"
    ],
    "dominant_colors": [
      "gray",
      "brown"
    ],
    "dominant_lines": "horizontal"
  },
  "sequencing": {
    "can_repeat": false,
    "min_gap_seconds": 0,
    "must_follow": [],
    "must_not_follow": [],
    "weight": 0.8
  },
  "created_at": "2026-07-02T00:00:00Z",
  "updated_at": "2026-07-02T00:00:00Z"
}
