{
  "artifact_id": "val_av_005",
  "collection_id": "validation",
  "artifact_type": "A-roll",
  "role": "body",
  "file": {
    "source_type": "local",
    "filename": "a-roll/gallery_monkey.mov",
    "format": "mov",
    "duration_seconds": 12.64,
    "has_video": true,
    "has_audio": true,
    "source": "self-recorded",
    "copyright_cleared": true,
    "resolution": "1214x2160"
  },
  "content": {
    "title": "Gallery monkey",
    "description": "A gallery-like encounter with a monkey subject, mixing playful attention and recorded ambience.",
    "theme": [
      "art-space",
      "animal-image",
      "looking"
    ],
    "mood": "triumphant",
    "pacing": "medium",
    "tags": [
      "gallery",
      "monkey",
      "display",
      "interior"
    ],
    "dominant_colors": [
      "brown",
      "white"
    ],
    "dominant_lines": "vertical"
  },
  "sequencing": {
    "can_repeat": false,
    "min_gap_seconds": 0,
    "must_follow": [],
    "must_not_follow": [],
    "weight": 0.6
  },
  "created_at": "2026-07-02T00:00:00Z",
  "updated_at": "2026-07-03T00:00:00Z"
}
