{
  "artifact_id": "val_xa_004",
  "collection_id": "validation",
  "artifact_type": "X-roll",
  "role": "body",
  "file": {
    "source_type": "local",
    "filename": "x-roll/birds_call.wav",
    "format": "wav",
    "duration_seconds": 10.478776,
    "has_video": false,
    "has_audio": true,
    "source": "self-recorded",
    "copyright_cleared": true
  },
  "content": {
    "title": "Bird calls",
    "description": "Bird call ambience used as a natural X-roll layer under unrelated visuals.",
    "theme": [
      "birds",
      "nature",
      "sound"
    ],
    "mood": "hopeful",
    "pacing": "medium",
    "tags": [
      "birds",
      "calls",
      "ambient",
      "nature"
    ]
  },
  "sequencing": {
    "can_repeat": false,
    "min_gap_seconds": 0,
    "must_follow": [],
    "must_not_follow": [],
    "weight": 0.6
  },
  "created_at": "2026-07-02T00:00:00Z",
  "updated_at": "2026-07-03T00:00:00Z"
}
