{
  "artifact_id": "val_av_004",
  "collection_id": "validation",
  "artifact_type": "A-roll",
  "role": "body",
  "file": {
    "source_type": "local",
    "filename": "val_av_004.mp4",
    "format": "mp4",
    "duration_seconds": 9,
    "has_video": true,
    "has_audio": true,
    "source": "self-recorded",
    "copyright_cleared": true,
    "resolution": "640x360"
  },
  "content": {
    "title": "Carnival crowd cheering",
    "description": "A dense, colorful street carnival erupts in cheering and drums as dancers pass.",
    "theme": [
      "celebration",
      "crowd",
      "joy"
    ],
    "mood": "triumphant",
    "pacing": "fast",
    "tags": [
      "color",
      "crowd",
      "festival",
      "motion"
    ],
    "dominant_colors": [
      "red",
      "yellow"
    ],
    "dominant_lines": "mixed"
  },
  "sequencing": {
    "can_repeat": false,
    "min_gap_seconds": 0,
    "must_follow": [],
    "must_not_follow": [],
    "weight": 0.7
  },
  "created_at": "2026-07-02T00:00:00Z",
  "updated_at": "2026-07-02T00:00:00Z"
}
