{
  "artifact_id": "val_av_006",
  "collection_id": "validation",
  "artifact_type": "A-roll",
  "role": "body",
  "file": {
    "source_type": "local",
    "filename": "a-roll/skate_boarding.mov",
    "format": "mov",
    "duration_seconds": 11.261678,
    "has_video": true,
    "has_audio": true,
    "source": "self-recorded",
    "copyright_cleared": true,
    "resolution": "480x320"
  },
  "content": {
    "title": "Skate boarding",
    "description": "A skateboarding clip with embedded sound, speed, and informal street movement.",
    "theme": [
      "skateboarding",
      "street",
      "motion"
    ],
    "mood": "urgent",
    "pacing": "fast",
    "tags": [
      "skateboard",
      "street",
      "movement",
      "youth"
    ],
    "dominant_colors": [
      "gray",
      "blue"
    ],
    "dominant_lines": "diagonal"
  },
  "sequencing": {
    "can_repeat": false,
    "min_gap_seconds": 0,
    "must_follow": [],
    "must_not_follow": [],
    "weight": 0.7
  },
  "created_at": "2026-07-02T00:00:00Z",
  "updated_at": "2026-07-03T00:00:00Z"
}
