{
  "artifact_id": "val_bv_001",
  "collection_id": "validation",
  "artifact_type": "B-roll",
  "role": "body",
  "file": {
    "source_type": "local",
    "filename": "val_bv_001.mp4",
    "format": "mp4",
    "duration_seconds": 13,
    "has_video": true,
    "has_audio": false,
    "source": "self-recorded",
    "copyright_cleared": true,
    "resolution": "640x360"
  },
  "content": {
    "title": "Time-lapse of storm clouds",
    "description": "Fast time-lapse of towering storm clouds boiling across a wide sky.",
    "theme": [
      "sky",
      "weather",
      "time"
    ],
    "mood": "tense",
    "pacing": "fast",
    "tags": [
      "timelapse",
      "clouds",
      "sky"
    ],
    "dominant_colors": [
      "gray",
      "white"
    ],
    "dominant_lines": "mixed"
  },
  "sequencing": {
    "can_repeat": false,
    "min_gap_seconds": 0,
    "must_follow": [],
    "must_not_follow": [],
    "weight": 0.6
  },
  "created_at": "2026-07-02T00:00:00Z",
  "updated_at": "2026-07-02T00:00:00Z"
}
