{
  "artifact_id": "val_xa_002",
  "collection_id": "validation",
  "artifact_type": "X-roll",
  "role": "body",
  "file": {
    "source_type": "local",
    "filename": "val_xa_002.wav",
    "format": "wav",
    "duration_seconds": 25,
    "has_video": false,
    "has_audio": true,
    "source": "self-recorded",
    "copyright_cleared": true
  },
  "content": {
    "title": "Cello drone",
    "description": "A sustained, mournful cello drone with slow harmonic movement.",
    "theme": [
      "music",
      "drone",
      "melancholy"
    ],
    "mood": "melancholic",
    "pacing": "slow",
    "tags": [
      "cello",
      "music",
      "drone"
    ]
  },
  "sequencing": {
    "can_repeat": false,
    "min_gap_seconds": 0,
    "must_follow": [],
    "must_not_follow": [],
    "weight": 0.5
  },
  "created_at": "2026-07-02T00:00:00Z",
  "updated_at": "2026-07-02T00:00:00Z"
}
