{
  "artifact_id": "val_av_001",
  "collection_id": "validation",
  "artifact_type": "A-roll",
  "role": "opening",
  "file": {
    "source_type": "local",
    "filename": "val_av_001.mp4",
    "format": "mp4",
    "duration_seconds": 10,
    "has_video": true,
    "has_audio": true,
    "source": "self-recorded",
    "copyright_cleared": true,
    "resolution": "640x360"
  },
  "content": {
    "title": "Empty highway at dawn",
    "description": "A deserted desert highway stretches to the horizon as the sun rises. Faint wind and distant birds.",
    "theme": [
      "road",
      "dawn",
      "stillness"
    ],
    "mood": "reflective",
    "pacing": "slow",
    "tags": [
      "exterior",
      "road",
      "sunrise",
      "quiet"
    ],
    "dominant_colors": [
      "orange",
      "gray"
    ],
    "dominant_lines": "horizontal"
  },
  "sequencing": {
    "can_repeat": false,
    "min_gap_seconds": 0,
    "must_follow": [],
    "must_not_follow": [],
    "weight": 0.5
  },
  "created_at": "2026-07-02T00:00:00Z",
  "updated_at": "2026-07-02T00:00:00Z"
}
