{
  "artifact_id": "val_bv_004",
  "collection_id": "validation",
  "artifact_type": "B-roll",
  "role": "body",
  "file": {
    "source_type": "local",
    "filename": "b-roll/colorful_ballerina.mp4",
    "format": "mp4",
    "duration_seconds": 9.008984,
    "has_video": true,
    "has_audio": false,
    "source": "self-recorded",
    "copyright_cleared": true,
    "resolution": "1920x1080"
  },
  "content": {
    "title": "Colorful ballerina",
    "description": "A colorful ballet movement clip, silent in the sequence and paired with separate X-roll audio.",
    "theme": [
      "dance",
      "performance",
      "color"
    ],
    "mood": "triumphant",
    "pacing": "medium",
    "tags": [
      "ballerina",
      "dance",
      "color",
      "stage"
    ],
    "dominant_colors": [
      "red",
      "purple"
    ],
    "dominant_lines": "curved"
  },
  "sequencing": {
    "can_repeat": false,
    "min_gap_seconds": 0,
    "must_follow": [],
    "must_not_follow": [],
    "weight": 0.6
  },
  "created_at": "2026-07-02T00:00:00Z",
  "updated_at": "2026-07-03T00:00:00Z"
}
