{
  "artifact_id": "val_bv_002",
  "collection_id": "validation",
  "artifact_type": "B-roll",
  "role": "body",
  "file": {
    "source_type": "local",
    "filename": "b-roll/waves_sunset.mp4",
    "format": "mp4",
    "duration_seconds": 9.033333,
    "has_video": true,
    "has_audio": false,
    "source": "self-recorded",
    "copyright_cleared": true,
    "resolution": "1920x1080"
  },
  "content": {
    "title": "Waves at sunset",
    "description": "Waves moving under sunset light, treated as silent visual material for audio pairing.",
    "theme": [
      "ocean",
      "sunset",
      "weather"
    ],
    "mood": "melancholic",
    "pacing": "slow",
    "tags": [
      "waves",
      "sunset",
      "water",
      "horizon"
    ],
    "dominant_colors": [
      "orange",
      "blue"
    ],
    "dominant_lines": "horizontal"
  },
  "sequencing": {
    "can_repeat": false,
    "min_gap_seconds": 0,
    "must_follow": [],
    "must_not_follow": [
      "val_bv_001"
    ],
    "weight": 0.7
  },
  "created_at": "2026-07-02T00:00:00Z",
  "updated_at": "2026-07-03T00:00:00Z"
}
